url,result
https://pmc.ncbi.nlm.nih.gov/articles/PMC3126903,Poor Pre-Pregnancy and Antepartum Mental Health Predicts Postpartum Mental Health Problems among US Women: A Nationally Representative Population-Based Study
https://pmc.ncbi.nlm.nih.gov/articles/PMC9640224,The Relationship Between Health Literacy and Mental Health Attitudes and Beliefs
https://pmc.ncbi.nlm.nih.gov/articles/PMC12542504,Validating a positive mental health measure with Portuguese adolescents and exploring associations with mental health perceived competencies
https://pmc.ncbi.nlm.nih.gov/articles/PMC5913777,Significance of mental health legislation for successful primary care for mental health and community mental health services: A review
https://pmc.ncbi.nlm.nih.gov/articles/PMC11280139,Willingness to use mental health counseling in diverse groups of Asian Americans
https://pmc.ncbi.nlm.nih.gov/articles/PMC8939830,"Baseline situational analysis in Bangladesh, Jordan, Paraguay, the Philippines, Ukraine, and Zimbabwe for the WHO Special Initiative for Mental Health: Universal Health Coverage for Mental Health"
https://pmc.ncbi.nlm.nih.gov/articles/PMC12017511,Recording of HIV diagnosis in mental health records: A data linkage cohort study
https://pmc.ncbi.nlm.nih.gov/articles/PMC11531048,Mental Health in Elite Coaches
https://pmc.ncbi.nlm.nih.gov/articles/PMC11805758,Mental health pluralism
https://pmc.ncbi.nlm.nih.gov/articles/PMC8046135,"Mental health shame, self‐compassion and sleep in UK nursing students: Complete mediation of self‐compassion in sleep and mental health"
https://pmc.ncbi.nlm.nih.gov/articles/PMC11301767,The Opportunities and Risks of Large Language Models in Mental Health
https://pmc.ncbi.nlm.nih.gov/articles/PMC10075459,"Mental health care in the city of Lubumbashi, Democratic Republic of the Congo: Analysis of demand, supply and operational response capacity of the health district of Tshamilemba"
https://pmc.ncbi.nlm.nih.gov/articles/PMC11789754,Working With and Through Athletic Trainers to Meet Student-Athletes’ Mental Performance and Mental Health Needs
https://pmc.ncbi.nlm.nih.gov/articles/PMC7569988,Factors associated with non-initiation of mental healthcare after detection of poor mental health at a scheduled health check: a cohort study
https://pmc.ncbi.nlm.nih.gov/articles/PMC4465576,Hope Thinking and Past Trauma Mediate the Relationships of Body Mass Index with Perceived Mental Health Treatment Need and Mental Health Treatment Use
https://pmc.ncbi.nlm.nih.gov/articles/PMC8425633,Impact of Mental Health Insurance Legislation on Mental Health Treatment in a Longitudinal Sample of Adolescents
https://pmc.ncbi.nlm.nih.gov/articles/PMC1563952,The Carter Center Mental Health Program: Addressing the Public Health Crisis in the Field of Mental Health Through Policy Change and Stigma Reduction
https://pmc.ncbi.nlm.nih.gov/articles/PMC4754802,Maternal mental health in primary care in five low- and middle-income countries: a situational analysis
https://pmc.ncbi.nlm.nih.gov/articles/PMC2978199,Change in Level of Positive Mental Health as a Predictor of Future Risk of Mental Illness
https://pmc.ncbi.nlm.nih.gov/articles/PMC6487880,Positive mental health as a predictor of recovery from mental illness.
https://pmc.ncbi.nlm.nih.gov/articles/PMC10626693,“I *know* all the things I should be doing …”: accounting for mental health and illness in an online mental health discussion forum during the COVID-19 pandemic
https://pmc.ncbi.nlm.nih.gov/articles/PMC3093935,The prevalence and determinants of antepartum mental health problems among women in the USA: a nationally representative population-based study
https://pmc.ncbi.nlm.nih.gov/articles/PMC7762903,A Right-to-Health Lens on Perinatal Mental Health Care in South Africa
https://pmc.ncbi.nlm.nih.gov/articles/PMC9555637,Mental health resources and its equity in Central South of China: A case study of Hunan Province
https://pmc.ncbi.nlm.nih.gov/articles/PMC8858475,Experience of clinical services shapes attitudes to mental health data sharing: findings from a UK-wide survey
https://pmc.ncbi.nlm.nih.gov/articles/PMC11562766,The unmet mental health needs of U.S. adults living with chronic pain
https://pmc.ncbi.nlm.nih.gov/articles/PMC4677043,Individual factors and perceived community characteristics in relation to mental health and mental well-being
https://pmc.ncbi.nlm.nih.gov/articles/PMC4024273,Workplace mental health: developing an integrated intervention approach
https://pmc.ncbi.nlm.nih.gov/articles/PMC7916140,"Definitions and Operationalization of Mental Health Problems, Wellbeing and Participation Constructs in Children with NDD: Distinctions and Clarifications"
https://pmc.ncbi.nlm.nih.gov/articles/PMC9764935,COVID-19 mental health impact and responses in low-income and middle-income countries: reimagining global mental health
https://pmc.ncbi.nlm.nih.gov/articles/PMC7606462,The Role of Self-Rated Mental Health in Seeking Professional Mental Health Services among Older Korean Immigrants
https://pmc.ncbi.nlm.nih.gov/articles/PMC7934536,Evaluation of mental health first aid training for family members of military veterans with a mental health condition
https://pmc.ncbi.nlm.nih.gov/articles/PMC8576887,Measuring mental wellness among adolescents living with a physical chronic condition: a systematic review of the mental health and mental well-being instruments
https://pmc.ncbi.nlm.nih.gov/articles/PMC5577712,Mental health challenges among adolescents living with HIV
https://pmc.ncbi.nlm.nih.gov/articles/PMC12818496,"Online Racism, Digital Mental Health Tools, and Online Mental Health Communication Among Black Young Adults With and Without Depression or Anxiety: Cross-Sectional Quantitative Study"
https://pmc.ncbi.nlm.nih.gov/articles/PMC4800478,The 2013 Canadian Forces Mental Health Survey
https://pmc.ncbi.nlm.nih.gov/articles/PMC4939463,Monitoring positive mental health and its determinants in Canada: the development of the Positive Mental Health Surveillance Indicator Framework
